{
  "schemaVersion": "0.1.0",
  "campaignId": "SYNTHETIC-COMPLETENESS-0.1",
  "sealedAt": "2026-08-01T00:00:00Z",
  "expectedExperimentCount": 8,
  "records": [
    {
      "experimentId": "AUD-001",
      "registeredAt": "2026-07-01T00:00:00Z",
      "targetHash": "79335ea6b1203dc79e64b6564a2b59cc4e39a7eaed47e051983c83a37081bff8",
      "stages": {
        "decision": {
          "status": "recorded",
          "occurredAt": "2026-07-01T00:05:00Z",
          "artifactHash": "e4efd492b357c9c21889cc5c2f7ffe3eb333f6cc7f4c15026426ee20ff0f7f2d",
          "reasonCode": null,
          "reasonRecordedAt": null,
          "outcomeKnownWhenReasonRecorded": null
        },
        "execution": {
          "status": "completed",
          "occurredAt": "2026-07-01T02:00:00Z",
          "artifactHash": "14efd0ff3f65b795d9e3f5743d3648798d2635e55545a6d7da38c4e49d4893c1",
          "reasonCode": null,
          "reasonRecordedAt": null,
          "outcomeKnownWhenReasonRecorded": null
        },
        "rawObservation": {
          "status": "present",
          "occurredAt": "2026-07-01T02:15:00Z",
          "artifactHash": "cae0d346d041a497666d1356a0ffb60a860621f8d69b4d414ca707bfc4494634",
          "reasonCode": null,
          "reasonRecordedAt": null,
          "outcomeKnownWhenReasonRecorded": null
        },
        "adjudication": {
          "status": "recorded",
          "occurredAt": "2026-07-01T04:00:00Z",
          "artifactHash": "5c0340ea0cd64ef4e0f8d02693f349c55ae40923fb42aec945bb4c958e856f53",
          "reasonCode": null,
          "reasonRecordedAt": null,
          "outcomeKnownWhenReasonRecorded": null
        },
        "release": {
          "status": "released",
          "occurredAt": "2026-07-01T05:00:00Z",
          "artifactHash": "920e0f210ebd4b6d9b79020527b33a7df4e0663d96fdbc5476f768ea472a8f8a",
          "reasonCode": null,
          "reasonRecordedAt": null,
          "outcomeKnownWhenReasonRecorded": null
        }
      },
      "outcome": "success",
      "recordDigest": "69fccb530cdb6893cef2ce1fc69d9a3e312a33d3b99700d6a1ffd19c46bef455"
    },
    {
      "experimentId": "AUD-002",
      "registeredAt": "2026-07-02T00:00:00Z",
      "targetHash": "8e29584b7564690bbc6e86fb1f0161a222143471f2fedfafbdc1e6e2ad1163d0",
      "stages": {
        "decision": {
          "status": "recorded",
          "occurredAt": "2026-07-02T00:05:00Z",
          "artifactHash": "705e55965921ab4bd211f8e1f0364e82c05f912d3e4867ce206c89e4dd139664",
          "reasonCode": null,
          "reasonRecordedAt": null,
          "outcomeKnownWhenReasonRecorded": null
        },
        "execution": {
          "status": "completed",
          "occurredAt": "2026-07-02T02:00:00Z",
          "artifactHash": "5278b279798fccb849cf5b5981da61ff7edddb25206c732857c6c464dc59f5bb",
          "reasonCode": null,
          "reasonRecordedAt": null,
          "outcomeKnownWhenReasonRecorded": null
        },
        "rawObservation": {
          "status": "present",
          "occurredAt": "2026-07-02T02:15:00Z",
          "artifactHash": "85e364c101bf82f9e93fd41834a386484c94f9b85807711e9845466a71b01a40",
          "reasonCode": null,
          "reasonRecordedAt": null,
          "outcomeKnownWhenReasonRecorded": null
        },
        "adjudication": {
          "status": "recorded",
          "occurredAt": "2026-07-02T04:00:00Z",
          "artifactHash": "91b8d9308ce490a38b5bc1648ff61da34f2b0d676217b24f601c36a313a2c16f",
          "reasonCode": null,
          "reasonRecordedAt": null,
          "outcomeKnownWhenReasonRecorded": null
        },
        "release": {
          "status": "released",
          "occurredAt": "2026-07-02T05:00:00Z",
          "artifactHash": "43d4e18fe723f3a6e3a2cd91e823e6a32e02a07e8b19cde0fb3a315361453d42",
          "reasonCode": null,
          "reasonRecordedAt": null,
          "outcomeKnownWhenReasonRecorded": null
        }
      },
      "outcome": "failure",
      "recordDigest": "94ecb252cd8c13321e60c2db0319b60044a668645057a802cf512303cfd26a7c"
    },
    {
      "experimentId": "AUD-003",
      "registeredAt": "2026-07-03T00:00:00Z",
      "targetHash": "082cf22fb6df4fe806d7303d6e2958dfb49ab97f2ef62fe08557b080f543410f",
      "stages": {
        "decision": {
          "status": "recorded",
          "occurredAt": "2026-07-03T00:05:00Z",
          "artifactHash": "b7963e4cdf69a460bb003af5a903756a05073907eb3bda30d0f5a561125dbe30",
          "reasonCode": null,
          "reasonRecordedAt": null,
          "outcomeKnownWhenReasonRecorded": null
        },
        "execution": {
          "status": "not-run",
          "occurredAt": null,
          "artifactHash": null,
          "reasonCode": "capacity-hold",
          "reasonRecordedAt": "2026-07-03T00:30:00Z",
          "outcomeKnownWhenReasonRecorded": false
        },
        "rawObservation": {
          "status": "absent",
          "occurredAt": null,
          "artifactHash": null,
          "reasonCode": "execution-not-completed",
          "reasonRecordedAt": "2026-07-03T02:05:00Z",
          "outcomeKnownWhenReasonRecorded": false
        },
        "adjudication": {
          "status": "not-applicable",
          "occurredAt": null,
          "artifactHash": null,
          "reasonCode": "raw-unavailable",
          "reasonRecordedAt": "2026-07-03T02:10:00Z",
          "outcomeKnownWhenReasonRecorded": false
        },
        "release": {
          "status": "withheld",
          "occurredAt": null,
          "artifactHash": null,
          "reasonCode": "incomplete-record",
          "reasonRecordedAt": "2026-07-03T03:00:00Z",
          "outcomeKnownWhenReasonRecorded": false
        }
      },
      "outcome": null,
      "recordDigest": "d09f06eb396542ecd5cdac72fecc30e6edbd9aab9beb18f4bea121631e8de6de"
    },
    {
      "experimentId": "AUD-004",
      "registeredAt": "2026-07-04T00:00:00Z",
      "targetHash": "5ef02e880a809f09b146041d5f4629a41e8fe79123f85ef989adbe48885f2556",
      "stages": {
        "decision": {
          "status": "recorded",
          "occurredAt": "2026-07-04T00:05:00Z",
          "artifactHash": "a7e2532e3d9b0291c6d517f88d60b1b2e4d06473e202631f1f04e2c9a5277737",
          "reasonCode": null,
          "reasonRecordedAt": null,
          "outcomeKnownWhenReasonRecorded": null
        },
        "execution": {
          "status": "failed",
          "occurredAt": "2026-07-04T02:00:00Z",
          "artifactHash": null,
          "reasonCode": "equipment-interlock",
          "reasonRecordedAt": "2026-07-04T00:30:00Z",
          "outcomeKnownWhenReasonRecorded": false
        },
        "rawObservation": {
          "status": "absent",
          "occurredAt": null,
          "artifactHash": null,
          "reasonCode": "execution-not-completed",
          "reasonRecordedAt": "2026-07-04T02:05:00Z",
          "outcomeKnownWhenReasonRecorded": false
        },
        "adjudication": {
          "status": "not-applicable",
          "occurredAt": null,
          "artifactHash": null,
          "reasonCode": "raw-unavailable",
          "reasonRecordedAt": "2026-07-04T02:10:00Z",
          "outcomeKnownWhenReasonRecorded": false
        },
        "release": {
          "status": "withheld",
          "occurredAt": null,
          "artifactHash": null,
          "reasonCode": "incomplete-record",
          "reasonRecordedAt": "2026-07-04T03:00:00Z",
          "outcomeKnownWhenReasonRecorded": false
        }
      },
      "outcome": null,
      "recordDigest": "7205e4b84e6934108dc2fb95d147858a244e7a9178f7dfe9efef206093ce4598"
    },
    {
      "experimentId": "AUD-005",
      "registeredAt": "2026-07-05T00:00:00Z",
      "targetHash": "e204514ff12acf7ed4ac19c4026120dc966144c089d3b8d19ced6e515afe9d02",
      "stages": {
        "decision": {
          "status": "recorded",
          "occurredAt": "2026-07-05T00:05:00Z",
          "artifactHash": "aed5b462c898dbca58874c7c1d03e05f3b2406bf8a97ba027a792f73b7b11ead",
          "reasonCode": null,
          "reasonRecordedAt": null,
          "outcomeKnownWhenReasonRecorded": null
        },
        "execution": {
          "status": "completed",
          "occurredAt": "2026-07-05T02:00:00Z",
          "artifactHash": "87fe57e1ecaf1259705a4daea326c1052f60775dbad4a0d96e6d2972c475aa83",
          "reasonCode": null,
          "reasonRecordedAt": null,
          "outcomeKnownWhenReasonRecorded": null
        },
        "rawObservation": {
          "status": "absent",
          "occurredAt": null,
          "artifactHash": null,
          "reasonCode": "raw-file-loss",
          "reasonRecordedAt": "2026-07-05T02:05:00Z",
          "outcomeKnownWhenReasonRecorded": false
        },
        "adjudication": {
          "status": "not-applicable",
          "occurredAt": null,
          "artifactHash": null,
          "reasonCode": "raw-unavailable",
          "reasonRecordedAt": "2026-07-05T02:10:00Z",
          "outcomeKnownWhenReasonRecorded": false
        },
        "release": {
          "status": "withheld",
          "occurredAt": null,
          "artifactHash": null,
          "reasonCode": "incomplete-record",
          "reasonRecordedAt": "2026-07-05T03:00:00Z",
          "outcomeKnownWhenReasonRecorded": false
        }
      },
      "outcome": null,
      "recordDigest": "efe25e6612b3b4e821f66d720d4422b227fcf08f22ef4928a5a8aa553de189ad"
    },
    {
      "experimentId": "AUD-006",
      "registeredAt": "2026-07-06T00:00:00Z",
      "targetHash": "5aa80f9c0985f9935d8106f238b1eb63e011d405e87bdc6535a0b078ddeeb7a0",
      "stages": {
        "decision": {
          "status": "recorded",
          "occurredAt": "2026-07-06T00:05:00Z",
          "artifactHash": "75a468542d56fded5e48ef574da1ebcf1ccff9b49265cef8c72e7b7697fc044d",
          "reasonCode": null,
          "reasonRecordedAt": null,
          "outcomeKnownWhenReasonRecorded": null
        },
        "execution": {
          "status": "completed",
          "occurredAt": "2026-07-06T02:00:00Z",